{
  "kind": "control_family_descriptor.v1",
  "version": "v1",
  "family_id": "D6",
  "canonical_name": "operational",
  "display_name": "Operational",
  "slug": "operational",
  "internal_id": "D6",
  "legacy_label": "D6-operational",
  "status": "active",
  "maturity": "seed",
  "classification_ref": "classification/classification-map.json",
  "specializations_ref": "domain-specializations/index/specializations.index.json",
  "materialized_manifest_ref": "families/materialized/operational.manifest.json",
  "hierarchy": {
    "parent": "",
    "specializations": [
      "incident-response",
      "change-control",
      "runbook-execution"
    ]
  },
  "resolution": {
    "default_specialization": "incident-response",
    "overlay_refs": {
      "regulatory": "overlays/regulatory/index/regulatory.index.json",
      "sector": "overlays/sector/index/sector.index.json",
      "contextual": "overlays/contextual/index/contextual.index.json"
    },
    "authority_profile": {},
    "evidence_profile": {}
  },
  "applicability": {
    "domains": [
      "operational"
    ],
    "risk_focus": [],
    "lead_vertical": false
  },
  "hooks": {
    "policy_composition": {
      "specializations": [
        "incident-response",
        "change-control",
        "runbook-execution"
      ],
      "legacy_seed_ref": "transitional/domain-family-seed/D6-operational"
    },
    "evidence": {
      "requires_policy_match_trace": false,
      "retention_hint": "standard"
    }
  },
  "source": {
    "materialized_manifest_ref": "families/materialized/operational.manifest.json",
    "generator": "tools/gen/build_control_family_descriptors.py"
  }
}
