{
  "kind": "control_family_descriptor.v1",
  "version": "v1",
  "family_id": "D9",
  "canonical_name": "environmental-climatological",
  "display_name": "Environmental-Climatological",
  "slug": "environmental-climatological",
  "internal_id": "D9",
  "legacy_label": "D9-environmental-climatological",
  "status": "active",
  "maturity": "seed",
  "classification_ref": "classification/classification-map.json",
  "specializations_ref": "domain-specializations/index/specializations.index.json",
  "materialized_manifest_ref": "families/materialized/environmental-climatological.manifest.json",
  "hierarchy": {
    "parent": "",
    "specializations": [
      "telemetry-integrity",
      "climate-risk-monitoring",
      "environmental-reporting"
    ]
  },
  "resolution": {
    "default_specialization": "telemetry-integrity",
    "overlay_refs": {
      "regulatory": "overlays/regulatory/index/regulatory.index.json",
      "sector": "overlays/sector/index/sector.index.json",
      "contextual": "overlays/contextual/index/contextual.index.json"
    },
    "authority_profile": {},
    "evidence_profile": {}
  },
  "applicability": {
    "domains": [
      "environmental-climatological"
    ],
    "risk_focus": [],
    "lead_vertical": false
  },
  "hooks": {
    "policy_composition": {
      "specializations": [
        "telemetry-integrity",
        "climate-risk-monitoring",
        "environmental-reporting"
      ],
      "legacy_seed_ref": "transitional/domain-family-seed/D9-environmental-climatological"
    },
    "evidence": {
      "requires_policy_match_trace": false,
      "retention_hint": "standard"
    }
  },
  "source": {
    "materialized_manifest_ref": "families/materialized/environmental-climatological.manifest.json",
    "generator": "tools/gen/build_control_family_descriptors.py"
  }
}
