{
  "kind": "control_family_descriptor.v1",
  "version": "v1",
  "family_id": "D3",
  "canonical_name": "biological",
  "display_name": "Biological",
  "slug": "biological",
  "internal_id": "D3",
  "legacy_label": "D3-biological",
  "status": "active",
  "maturity": "seed",
  "classification_ref": "classification/classification-map.json",
  "specializations_ref": "domain-specializations/index/specializations.index.json",
  "materialized_manifest_ref": "families/materialized/biological.manifest.json",
  "hierarchy": {
    "parent": "",
    "specializations": [
      "chain-of-custody",
      "sample-handling",
      "bio-risk-gating"
    ]
  },
  "resolution": {
    "default_specialization": "chain-of-custody",
    "overlay_refs": {
      "regulatory": "overlays/regulatory/index/regulatory.index.json",
      "sector": "overlays/sector/index/sector.index.json",
      "contextual": "overlays/contextual/index/contextual.index.json"
    },
    "authority_profile": {},
    "evidence_profile": {}
  },
  "applicability": {
    "domains": [
      "biological"
    ],
    "risk_focus": [],
    "lead_vertical": false
  },
  "hooks": {
    "policy_composition": {
      "specializations": [
        "chain-of-custody",
        "sample-handling",
        "bio-risk-gating"
      ],
      "legacy_seed_ref": "transitional/domain-family-seed/D3-biological"
    },
    "evidence": {
      "requires_policy_match_trace": false,
      "retention_hint": "standard"
    }
  },
  "source": {
    "materialized_manifest_ref": "families/materialized/biological.manifest.json",
    "generator": "tools/gen/build_control_family_descriptors.py"
  }
}
